source_job_id,title,company,location,created_at,description
5699972448,Senior Software Development Engineer ( Machine Learning),Media.net,"Bangalore, Karnataka",2026-04-15T15:07:51Z,"Job Title: Senior Software Development Engineer (Machine learning) About Media.net: Media.net is a leading global ad tech company, building innovative products and solutions for advertisers and publishers. Media.net creates the most transparent and efficient path for ad budgets to become publisher revenue, while delivering meaningful value to advertisers, publishers, app developers, and end users across the open web. We are one of the world’s largest independent contextual advertising businesse…"
5659603481,Software Development Engineer II (Machine Learning),Media.net,"Bangalore, Karnataka",2026-03-10T01:43:41Z,"SDE II – Machine Learning Location: Bangalore Experience: 3–6 years About Media.net Media.net is a leading global ad tech company, building innovative products and solutions for advertisers and publishers. Media.net creates the most transparent and efficient path for ad budgets to become publisher revenue, while delivering meaningful value to advertisers, publishers, app developers, and end users across the open web. We are one of the world’s largest independent contextual advertising businesse…"
5750870018,Software Development Engineer II (Backend) - Adtech,JioHotstar,"Bangalore, Karnataka",2026-06-04T00:41:16Z,"Job Summary : As an SDE-II, you will design and build high-performance services that power mission-critical ad delivery, targeting, and measurement systems across JioStar's platform. You will operate at the intersection of scale, reliability, and real-time decisioning - supporting live sports, premium entertainment, and personalized experiences for millions of users. This is a high-ownership, high-impact role best suited for engineers passionate about building for scale and business impact. Abo…"
5747038442,"Senior Software Engineer (Required Skills - .Net 8, Gen AI, Agentic AI, LLM, Python, Azure)",H&R Block India,"Thiruvananthapuram, Kerala",2026-06-01T10:19:46Z,"Senior Software Engineer (Security Enablement – Agentic AI) As a Senior GenAI Developer, you will be responsible for designing, developing, and integrating advanced Generative AI capabilities with security platforms and applying data science techniques to improve decision-making and automation. You will bridge traditional backend engineering with modern AI/ML and data engineering practices, leveraging both the .NET and/or Python ecosystems to build intelligent, scalable systems such as Retrieva…"
5765340288,"Leader, Software Engineering | C, C++, BSP, SONiC, Device Driver, Linux, Kernel, People Leader | 12 years",Cisco,"Bangalore, Karnataka",2026-06-16T14:58:46Z,"As a Senior Manager within the Common Hardware Group (CHG), you will lead a high-performing team of software engineers responsible for the reliability, performance, and innovation of Cisco’s world-class hardware. You will be at the forefront of developing software for Cisco’s network switches and routers, enabling advanced application awareness and supporting the complex workload demands of AI and ML. In this senior leadership role, you will define the technical strategy, cultivate a culture of…"
5762136466,Senior Software Development Engineer in Test (Senior SDET),BlinkRx,"Bangalore, Karnataka",2026-06-13T10:53:19Z,"About the role: As a Senior Software Development Engineer in Test I (Senior SDET I), you will design and implement robust testing strategies and automation solutions for complex, cross-team product features. You will own the end-to-end automation roadmap for one or more modules defining strategic goals, execution plans, and success metrics. The SDET team plays an important role in our company’s product development process. You’ll collaborate closely with engineers, TPMs, and product leaders to …"
5756250932,AI Engineer,KPMG India,"Bangalore, Karnataka",2026-06-08T17:55:52Z,"Full-time, on-site role for an AI Engineer (LLM & Application Development), based in Bengaluru, Mumbai, NCR or Hyderabad. Experience Level: 4–8 Years Role Overview We are looking for a skilled AI Engineer with a strong foundation in software engineering and production-grade application development. In this role, you will bridge the gap between cutting-edge AI research and practical, scalable software. You will be responsible for designing, building, and deploying AI-powered applications, with a…"
5762127191,Back End Developer,Zywave,India,2026-06-13T10:50:12Z,"Senior Software Engineer (SSE) – .NET Location: Pune, Maharashtra, India Work Mode: Hybrid Experience: 4–8 years About Zywave Zywave is a global leader in building innovative SaaS products that transform the insurance industry. Our engineering teams thrive on problem-solving, collaboration, and continuous improvement. We are expanding our Product Development organization in India and are looking for strong .NET engineers to help build scalable, secure, and modern cloud-enabled applications. Rol…"
