source_job_id,title,company,location,created_at,description
5771700658,Linux Software Engineer,AI Company ,India,2026-06-21T17:11:17Z,"Company Description AI Company (Confidential) is an emerging organization focused on building advanced software solutions in the artificial intelligence and data-driven technology space. The company emphasizes high-quality engineering practices, scalable systems, and robust infrastructure to support AI workloads. Team members collaborate closely across disciplines to deliver reliable products and tools that power intelligent applications. The environment encourages ownership, innovation, and co…"
5768223125,Software Engineer in Test,Scitara Corporation,"Mumbai, Maharashtra",2026-06-18T21:47:12Z,"Software Development Engineer in Test (SDET) Role Title: Software Development Engineer in Test (Mid / Senior / Lead) Department: Product Engineering Location: Mumbai / Pune (Onsite) Reports To: Engineering Manager Experience: 6 years (hiring across mid to lead levels) Employment Type: Full-time About Scitara Scitara is a global leader in digital transformation for scientific laboratories, enabling connectivity, automation, and data integrity across instruments, applications, and enterprise syst…"
5762608106,Software Engineer in Test,Licious,"Bangalore, Karnataka",2026-06-13T18:46:43Z,"We are seeking a Software Development Engineer in Test (SDET I) who is passionate about building quality into every stage of the software development lifecycle. This role is ideal for an automation-first engineer who enjoys solving complex quality challenges, building scalable test frameworks, and partnering closely with product and engineering teams to deliver exceptional customer experiences. What You'll Be Doing Automation-First Quality Engineering : Contribute to the quality of features thr…"
5727037878,Software Engineering Consultant,LTM,"Bangalore, Karnataka",2026-05-13T01:04:15Z,We are hiring for ServiceNow Integration Developer. About the Role: Experience: 5 to 12 years. Notice period: 0 to 30 days. Location: LTM Pan locations. Responsibilities SecOps Module expertise: 5 to 8 years working with ServiceNow platform in enterprise wide multi tier ServiceNow production environment. Work on bug fixes and core platform developments. Familiar with Service Oriented architecture and web services integration SOAP WSDL REST. Provide software coding and customization including bu…
5771866668,Software Engineer in Test,ThoughtFocus,India,2026-06-22T01:12:53Z,"Job Title: Mobile Automation Engineer — IoT Platform About the Role We are looking for a hands-on Mobile Automation Engineer to participate in and evolve the automated testing strategy for IoT mobile platform across Flutter, iOS, and Android. This role focuses on building reliable integration and functional automation that validates end-to-end user experiences - from app-to-cloud communication to real-time device state changes. You will work closely with mobile and backend engineers to ensure f…"
5771700864,LINUX SOFTWARE ENGINEER,Iravan Technologies,India,2026-06-21T17:11:52Z,"About Iravan: Iravan Technologies, headquartered in Pune, is a semiconductor design services company specializing in Mixed-Signal, Digital, and Formal Verification. We partner with leading companies across Storage, Networking, Aerospace, Automotive, Defense, and other critical industries to deliver advanced semiconductor solutions. Location : Pune, India (Remote/Hybrid) Department : R&D Type : Full-time Experience : 10 years (lead) / 5 years (developer); Key Responsibilities Develop and maintai…"
5536062597,Software Engineer in Test,Arcana,"Bangalore, Karnataka",2025-12-10T16:48:00Z,"We are looking for a meticulous SDET who will be responsible for the design and implementation of automated tests and test environments for Arcana. The engineer must have a passion for diving into data and technology, be a problem solver, and have a desire to improve software quality within a team environment. This role is critical in ensuring technology functions efficiently and effectively, minimizes errors, and helps meet software quality goals. Responsibilities : Collaborate with various te…"
5762131039,Network Software Engineer,Alp Consulting Ltd.,"Bangalore, Karnataka",2026-06-13T10:51:28Z,"Job Description: What you’ll do :Lead multiple project teams (internal and outsourced) across the full software development lifecycle, including design, development, testing, and integration for complex products and platforms .Own and drive system architecture, ensuring effective design and integration of software systems across multiple platforms .Manage and strengthen relationships with internal stakeholders and external development partners .Review system designs and project activities to en…"
5769653232,Software Engineer AI ML,TCS,"Hyderabad, Telangana",2026-06-20T02:56:04Z,"Job Description: Software Engineer – Machine Learning About the Role We are looking for a skilled Software Engineer – Machine Learning to join a collaborative team focused on building predictive analytics solutions. The role involves working closely with data scientists, MLOps engineers, and analytics engineers to develop and maintain software systems that support machine learning models. Key Responsibilities Develop and test system code using standard software development practices for predict…"
5773100232,SMTS- System Software Engineer,Tsavorite Scalable Intelligence,India,2026-06-23T07:55:58Z,"SMTS-System Software Engineer LOCATION: GREATER BENGALURU AREA Company Description We are looking for exceptional talent and leadership to join Fast Growing Startup into Scalable Intelligence, the world’s first company developing Agentic Silicon for powering the future of AI. Founded in 2023, We have deep customer engagements across America, Europe, and Asia, and demonstrated functional prototypes to prove our concept and vision. Responsibilities: Design and develop the system software required…"
5737564081,"Manager, Software Engineering (Cybersecurity)",ConnectWise,India,2026-05-22T17:48:03Z,"Role Summary the Manager of Software Engineering is responsible for leading a global team of entry-level to experienced professionals focused on developing high-quality, innovative, and fully performing software in compliance with coding standards. This role balances strategic leadership with technical execution, supporting the coordination of resources and processes to deliver successful software releases while driving initiatives that align with the organization’s vision and goals Key Respons…"
5758688765,Senior Software Engineer - Backend,GoodScore,"Bangalore, Karnataka",2026-06-11T00:09:42Z,"Goodscore is on a mission to make financial literacy and credit access simple, actionable, and inclusive for over 150 million Indians who are credit-underserved. From starting personalized credit consulting in 2023 to now empowering over 5 million users to take control of their credit health, we are one of India’s fastest-growing credit score & credit management apps. We are backed by leading VC funds in India, consistently ranked among the top 10 finance apps in the country, and are currently …"
5721774818,"Software Engineer, Machine Learning",Ema,"Bangalore, Karnataka",2026-05-07T20:23:10Z,"About the Company Ema is building the next generation AI technology to empower every employee in the enterprise to be their most creative and productive. Our proprietary tech allows enterprises to delegate most repetitive tasks to Ema, the AI employee. We are founded by ex-Google, Coinbase, Okta executives and serial entrepreneurs. We’ve raised capital from notable investors such as Accel Partners, Naspers, Section32 and a host of prominent Silicon Valley Angels including Sheryl Sandberg (Faceb…"
5763492103,Vice President of Software Engineering,Perficient India,"Hyderabad, Telangana",2026-06-14T14:47:59Z,"The VP of Software Development Delivery Manager will provide technical leadership while collaborating with Business and Product teams on the vision-setting through to the implementation of the next level of our advisor digital platform. In this role, you will be responsible for the delivery of deep customisation, scalability, and streamlined experience. Responsibilities: • Experience leading multiple development teams across various value streams providing nurturing leadership and talent develo…"
5766009761,SMTS-System Software Engineer  Security,Tsavorite Scalable Intelligence,India,2026-06-17T03:11:12Z,". SMTS-System Software Engineer  Security LOCATION: GREATER BENGALURU AREA Company Description We are looking for exceptional talent and leadership to join Fast Growing Startup into Scalable Intelligence, the world’s first company developing Agentic Silicon for powering the future of AI. Founded in 2023, We have deep customer engagements across America, Europe, and Asia, and demonstrated functional prototypes to prove our concept and vision. . System Software Engineer  Security Responsibilities…"
5374986506,Lead Software Engineer (UI - React),InRhythm,India,2025-08-30T14:43:26Z,"We’re Looking For a Lead Software (UI - React) Engineer! Our Team is looking for someone who has a passion for building rich web applications. This individual will own the full software development lifecycle to assess, and deliver critical web application that will directly impact hundreds of thousands to millions of users. This individual will also help grow and coach engineers to realize their full potential as much as be mentored and coached themselves for upward career acceleration. We work…"
5742256145,Linux Kernel - Staff Software Engineer,Qualcomm,"Hyderabad, Telangana",2026-05-27T18:10:15Z,"General Summary: As a Staff Software Engineer, you will contribute to the design, development, debug, optimization and commercialization of software solutions for Qualcomm’s next-generation IoT platforms. You will collaborate closely with cross-functional teams and lead a team of Engineers and contribute to the advancement of critical technologies such as virtualization, memory management, scheduler and Linux Kernel. Key Responsibilities  Contribute to architecture and development of Linux kern…"
5765034952,Senior Staff IT Software Engineer,Palo Alto Networks,India,2026-06-16T09:32:03Z,"Our Mission At Palo Alto Networks®, we’re united by a shared mission—to protect our digital way of life. We thrive at the intersection of innovation and impact, solving real-world problems with cutting-edge technology and bold thinking. Here, everyone has a voice, and every idea counts. If you’re ready to do the most meaningful work of your career alongside people who are just as passionate as you are, you’re in the right place. Who We Are In order to be the cybersecurity partner of choice, we …"
5753853836,Senior Software Engineer (Storage Developer),Rakuten Symphony,"Bangalore, Karnataka",2026-06-06T07:38:18Z,"Why should you choose us? Are you interested in working for a Global Leader in E-commerce? Are you excited about working on highly scalable platforms and applications that are accessed by millions of users every day? If so, read on to find out more about the opportunity. Rakuten Symphony is a Rakuten Group company, providing global B2B services for the mobile telco industry and enabling next-generation, cloud-based, international mobile services. Building on the technology Rakuten used to launc…"
5770874587,"Staff Software Engineer, Storage Filesystem",Cohesity,"Bangalore, Karnataka",2026-06-21T01:10:23Z,"Want to join the leader in AI-powered data security? As part of this core development team, you will design and build massively distributed systems at web-scale. You will be building the core backend of the Cohesity Data Platform and Cohesity SpanFS (limitless Filesystem). Cohesity Data Platform is a limitless scale out system. It is the industry’s only hyperconverged platform designed to consolidate ALL secondary storage and data services built on web-scale distributed architecture. Cohesity S…"
5528018023,Software Engineer Backend (SDE 2),Arcana,India,2025-12-05T01:34:33Z,"Join our dynamic team at the forefront of cutting-edge technology as we seek a SDE2 (Backend). Embark on a journey where your deep-rooted expertise in computer science fundamentals, alongside an intricate understanding of data structures, algorithms, and system design, becomes the cornerstone of innovative solutions. This pivotal role not only demands your proficiency in developing and elevating compute and I/O-intensive applications but also ensures their peak performance and unwavering reliab…"
5745440113,Embedded Software Engineer (C/C++ / Linux),L&T Technology Services,"Hyderabad, Telangana",2026-05-30T14:32:11Z,"Job Title: Embedded Software Engineer (C/C++ / Linux) Experience: 5 Years Location: Hyderabad Job Summary: We are looking for an experienced Embedded Software Engineer with strong expertise in C/C++, Linux-based development, and connectivity protocols. The candidate will be responsible for designing, developing, and optimizing embedded software solutions while ensuring high-quality coding standards and system performance. Key Responsibilities: Design, develop, and maintain embedded software app…"
5769670304,Senior Software Engineer – Telecommunications Core Networks,Polaris Wireless,"Bangalore, Karnataka",2026-06-20T02:59:38Z,"About Polaris Wireless Polaris Wireless is a Silicon Valley-based innovator of software-driven wireless Location Intelligence solutions, founded in 2001. The company locates mobile devices across all carrier networks and air interfaces (2G–5G) using patented RF pattern-matching technology (WLS™) that is immune to spoofing or disabling and includes a certified indoor 3D vertical location solution. Its analytics platform applies AI/ML and agentic AI to petabytes of location data, enabling real-ti…"
5743507155,Software Engineering Senior Analyst - Java fullstack,Evernorth Health Services,"Hyderabad, Telangana",2026-05-28T18:20:20Z,"ABOUT EVERNORTH: Evernorth℠ exists to elevate health for all, because we believe health is the starting point for human potential and progress. As champions for affordable, predictable and simple health care, we solve the problems others don’t, won’t or can’t. Our innovation hub in India will allow us to work with the right talent, expand our global footprint, improve our competitive stance, and better deliver on our promises to stakeholders. We are passionate about making healthcare better by …"
5760147557,Senior Staff Software Engineer (Site Reliability),slice,"Bangalore, Karnataka",2026-06-12T00:16:22Z,"slice A new bank for a new India slice’s purpose is to make the world better at using money and time, with a major focus on building the best consumer experience for your money. We’ve all felt how slow, confusing, and complicated banking can be. So, we’re reimagining it. We’re building every product from scratch to be fast, transparent, and feel good, because we believe that the best products transcend demographics, like how great music touches most of us. Our cornerstone products and services:…"
5768228415,Software Engineer Backend (Java)  Data Engineering,HDFC Bank,"Navi Mumbai, Maharashtra",2026-06-18T21:48:12Z,"We are looking for experienced engineers who can combine strong Java development expertise with modern Data Engineering capabilities to design and build enterprise-scale solutions. Location: Airoli, Navi Mumbai Experience Required: 8–20 Years ( Hands-on development experience is mandatory ) Skillset Required: Core Programming (Primary Skill) : Java , spring boot framework, knowledge of python and ML. Data Engineering & Big Data : Spark / PySpark, ETL and Data Pipeline Development , Apache Icebe…"
5697517948,Senior Software Engineer-Network Security Developement,ACL Digital,"Karnataka, India",2026-04-13T00:40:44Z,"Dear Connections, ACL Digital is hiring permanent job for Network Security Developer for Bangalore location. Job Title: Network Security Developer Experience: 8 – 12 Years Location: Bangalore Notice Period: Immediate / Short Notice Preferred Job Summary We are looking for an experienced Network Security Developer with strong expertise in VPN, SD-WAN, and network security protocols . The ideal candidate will have deep knowledge of system-level programming, cryptography, and large-scale distribut…"
5771700299,AI Engineer/ Forward Deployed Software Engineer (FDSE),Kwan Ventures,India,2026-06-21T17:09:55Z,"About Our Client Our client is a leading AI company building cutting-edge products and infrastructure that enable enterprises to deploy AI at scale. Backed by top-tier investors and experiencing rapid growth, the company is at the forefront of Generative AI, AI Agents, and Enterprise Automation. They are looking for exceptional AI Engineers / Forward Deployed Software Engineers who combine deep technical expertise with a customer-first mindset and are excited to solve real-world problems throug…"
5771700516,Software Systems Engineer,LevelUP HCS,"Hyderabad, Telangana",2026-06-21T17:10:58Z,"Senior Software Systems Engineer Job location – Abu Dhabi, UAE Position Summary: We are seeking an experienced Senior Software Systems Engineer with a strong background in the aerospace industry to join our team. The ideal candidate will have 6 years of experience in software systems engineering, including expertise in systems documentation, integration, Software Requirements Definition (SRD), verification and validation processes, and a thorough understanding of the V-Model and Agile developme…"
5770623160,Software Systems Engineer,LevelUP HCS,"Bangalore, Karnataka",2026-06-20T17:07:34Z,"Senior Software Systems Engineer Job location – Abu Dhabi, UAE Position Summary: We are seeking an experienced Senior Software Systems Engineer with a strong background in the aerospace industry to join our team. The ideal candidate will have 6 years of experience in software systems engineering, including expertise in systems documentation, integration, Software Requirements Definition (SRD), verification and validation processes, and a thorough understanding of the V-Model and Agile developme…"
5771759955,Software Systems Engineer,LevelUP HCS,India,2026-06-21T19:40:18Z,"Senior Software Systems Engineer Job location – Abu Dhabi, UAE Position Summary: We are seeking an experienced Senior Software Systems Engineer with a strong background in the aerospace industry to join our team. The ideal candidate will have 6 years of experience in software systems engineering, including expertise in systems documentation, integration, Software Requirements Definition (SRD), verification and validation processes, and a thorough understanding of the V-Model and Agile developme…"
5770874471,Software Test Engineer,AQM Technologies,India,2026-06-21T01:09:28Z,"We are looking for experienced Manual Testers with expertise in Banking domain . Immediate to notice period serving candidates preferred.  Open Positions: Mumbai. • Treasury Testing / Operations • CMS (Cash Management System) • Trade Finance • Flexcube (Retail Banking) • Test Lead - LMS If you have relevant experience and are looking for a new opportunity, please share your resume or connect at pranav.shirke@aqmtechnologies.com"
5768223070,Software Test Engineer,Insight Global,India,2026-06-18T21:47:11Z,"REMOTE in India Data Tester 15-30 day join or less Required Skills & Experience Hands-on experience with AWS services: Redshift,, QuickSight Strong SQL expertise (joins, subqueries, analytical functions) Proficiency in MySQL Familiarity with UNIX commands for log analysis and job monitoring. Experience with RedShfit. Experience writing test automation scripts for data pipelines Project Overview: This role supports a critical data migration initiative, testing the transition from a legacy applic…"
5769665458,Senior Software Engineer – Telecommunications Network Management Systems (NMS),Polaris Wireless,"Bangalore, Karnataka",2026-06-20T02:58:46Z,"About Polaris Wireless Polaris Wireless is a Silicon Valley-based innovator of software-driven wireless Location Intelligence solutions, founded in 2001. The company locates mobile devices across all carrier networks and air interfaces (2G–5G) using patented RF pattern-matching technology (WLS™) that is immune to spoofing or disabling and includes a certified indoor 3D vertical location solution. Its analytics platform applies AI/ML and agentic AI to petabytes of location data, enabling real-ti…"
5763490805,"Senior Software Engineer (Python, GEN AI, AI/ML)",Programmers.io,"Jaipur, Rajasthan",2026-06-14T14:46:02Z,"We are seeking an experienced Senior Software Engineer – Python  AI/ML & Generative AI The ideal candidate will have strong hands-on expertise in machine learning, generative AI, cloud platforms (Azure/AWS), and Python-based backend development . Experience - 6-14 years Notice Period - IMMEDIATE JOINERS ONLY Skill- Python, Generative ai/LLM, Rag. fast api Job Location - work from home (Hybrid for Jaipur, Hyderabad) JOB DESCRIPTION Design and implement end-to-end AI/ML pipelines , from business …"
5742256499,"Senior Software Engineer (Python, GEN AI, AI/ML)",Programmers.io,India,2026-05-27T18:10:44Z,"We are seeking an experienced Senior Software Engineer – Python  AI/ML & Generative AI The ideal candidate will have strong hands-on expertise in machine learning, generative AI, cloud platforms (Azure/AWS), and Python-based backend development . Experience - 6-14 years Notice Period - IMMEDIATE JOINERS ONLY Skill- Python, Generative ai/LLM, Rag. fast api Job Location - work from home (Hybrid for Jaipur, Hyderabad) JOB DESCRIPTION Design and implement end-to-end AI/ML pipelines , from business …"
5745168909,Consultant Software Engineer / Consultant Business Analyst – Oracle HCM Functional,Qruize Inc,"Bangalore, Karnataka",2026-05-30T08:30:45Z,Hiring Alert – Oracle HCM Functional Consultant | Bangalore We are looking for experienced Oracle HCM Functional Consultants with strong implementation and client-facing experience in Oracle HCM Cloud modules.  Location: Bangalore  Experience: 10 Years  Key Skills Required: ✅ Oracle HCM Functional ✅ Core HR ✅ Absence Management ✅ OTL ✅ Compensation ✅ Talent Suite / ORC ✅ Performance & Goals ✅ Talent & Succession ✅ Dynamic Skills ✅ Security & AOR ✅ BPM Workflows ✅ Fast Formula  Responsibilities:…
5750498361,"Staff IT Software Engineer, Full Stack (Java / React / GCP AI)",Palo Alto Networks,"Bangalore, Karnataka",2026-06-03T16:40:41Z,"Our Mission At Palo Alto Networks®, we’re united by a shared mission—to protect our digital way of life. We thrive at the intersection of innovation and impact, solving real-world problems with cutting-edge technology and bold thinking. Here, everyone has a voice, and every idea counts. If you’re ready to do the most meaningful work of your career alongside people who are just as passionate as you are, you’re in the right place. Who We Are In order to be the cybersecurity partner of choice, we …"
5768228350,Staff Software Development Engineer - Backend,JioHotstar,India,2026-06-18T21:48:11Z,"Job Summary: As a Staff Software Engineer, you will lead the design and development of core backend systems that power large-scale, high-performance platforms. You’ll own complex projects end to end, operate with autonomy, and play a key role in shaping the architecture and future direction of high-throughput, low-latency systems. This role is ideal for engineers who thrive on solving challenging distributed systems problems and mentoring others toward engineering excellence. About the team: Ji…"
5763491608,Senior Software Dev Engineer - Frontend,Landmark Group,"Bangalore, Karnataka",2026-06-14T14:47:10Z,"We are seeking a highly skilled Senior Software Dev Engineer with 5 years of experience in JavaScript, React.js, and TypeScript to build scalable, high-performance web applications. The ideal candidate should have strong expertise in modern UI development, testing frameworks, state management, and performance optimization, along with exposure to cloud platforms and CI/CD practices. Experience integrating AI-driven capabilities into frontend workflows and a passion for building exceptional user …"
5765772212,Senior Software Development Engineer in Test,Ivanti,India,2026-06-17T00:57:33Z,"Why this role matters We're looking for a technical leader who thinks in systems, drives impact across teams, and raises the engineering bar at every level. As a Senior SDET, you'll be the bridge between engineering execution and long-term technical vision, turning ambiguity into clarity and complex problems into elegant solutions. If you're someone who takes ownership, influences without authority, and leaves every codebase better than you found it -this role was built for you. What you’ll do:…"
5725262839,Senior Software Test Engineer I (Cybersecurity),ConnectWise,India,2026-05-11T00:53:57Z,"General Summary: The Senior Software Test Engineer I is responsible for creating and maintaining automated tests from manual test scripts and test cases. This role works in partnership with the Engineering teams to provide support on functional requirements, product designs, schedules, and potential problems Essential Duties & Responsibilities: • Provides support to the Quality Engineering teams, with a high attention to detail in a disciplined agile environment • Researches, analyzes, and docu…"
