source_job_id,title,company,city,state,country,created_at,description
5768551217,Software Engineer,Finastra Technology,Pune,Maharashtra,India,2026-06-19 02:32:24+00:00,"Who are we? At Finastra, we’re a global leader in financial services software, dedicated to expanding access to financial services and shaping what’s next for the industry. Our technology powers mission‑critical solutions across Lending, Payments and Universal Banking, supporting over 7,000 customers, including 80% of the world’s top 50 banks, in more than 110 countries. What will you contribute? Reporting to the Engineering Manager , the Software Engineer designs, develops, analyzes, and maint…"
5771929172,Software Engineer,Trimble,Chennai,Tamil Nadu,India,2026-06-22 02:27:29+00:00,"Shape the Future of Infrastructure Digitalization as a Software Engineer 1 (AECO / Owner & Public Sector) Are you a high-potential graduate or early-career engineer eager to build world-class SaaS solutions using the latest AI-augmented development tools? Our Owner & Public Sector team in India is looking for a Software Engineer 1 who is ready to jump into a high-velocity, modern development environment. You will have a unique opportunity to learn from global engineering leaders while working o…"
5771984628,Software Engineer,Zelis,,,India,2026-06-22 02:39:53+00:00,"About Us Zelis is modernizing the healthcare financial experience in the United States (U.S.) across payers, providers, and healthcare consumers. We serve more than 750 payers, including the top five national health plans, regional health plans, TPAs and millions of healthcare providers and consumers across our platform of solutions. Zelis sees across the system to identify, optimize, and solve problems holistically with technology built by healthcare experts – driving real, measurable results …"
5772985315,Software Engineer,Eurofins GSC IT DC,Bangalore,Karnataka,India,2026-06-23 05:55:07+00:00,"Job Description Senior Software Engineer as part of the respective scrum team should have the ability to analyze, code and deliver tasks as planned with defined quality Also appreciate to have the ability to learn and acquire new technology skills as a long term objective. This role expects the candidate to work closely with the scrum team effectively understand the requirements and think through all possible use cases and deliver a quality code per the defined standard and timelines. What we o…"
5773365170,Software Engineer,Capgemini,Bangalore,Karnataka,India,2026-06-23 14:56:42+00:00,"Choosing Capgemini means choosing a company where you will be empowered to shape your career in the way you’d like, where you’ll be supported and inspired by a collaborative community of colleagues around the world, and where you’ll be able to reimagine what’s possible. Join us and help the world’s leading organizations unlock the value of technology and build a more sustainable, more inclusive world. Your Role : Develop scalable backend services using ASP.NET Core, implementing RESTful APIs an…"
5774024619,Software Engineer,GE Vernova,,,India,2026-06-24 02:35:47+00:00,"Job Description Summary We are seeking a talented Software Engineer to join our team. The ideal candidate will possess strong skills in Python and Java. The primary responsibility will be to develop and maintain embedded software for our products, ensuring high-quality code and system reliability. Additionally, familiarity with IEC-61850 standards and knowledge of HVDC systems are considered advantageous. Job Description Key Responsibilities: Design, develop, test, and debug Python/Java based s…"
5774235889,Software Engineer/Sr. Software Engineer,Augusta Infotech,Bangalore,Karnataka,India,2026-06-24 07:22:51+00:00,"Big Data Developer with Java / Python / Scala and NoSQL (2 - 6 Years) Hiring: S/W Engineer / Senior S/W Engineer (2- 6yrs) from Java/ Python/ Scala with following skills and experience. Your Opportunity: To deliver results in a business driven by innovation at scale, you will need to be collaborative in a multi-disciplinary team. From designing algorithms to engaging clients to developing codes in Java, a career with us will never let your learning curve hit a saturation point. You will evolve …"
5774236635,Software Engineers,Augusta Infotech,Gurgaon,Haryana,India,2026-06-24 07:23:00+00:00,"The position is for Senior Analyst Programmer in Data team. The role involves development for the application involving strong Python programming, integration with Oracle DB interfaces, Bulk data distribution/consumption through data services, along with some exposure to PL/SQL, Performance Tuning knowledge on Oracle database platform. The candidate should have core skills of Python scripting. In addition, hands-on experience with Devops and Control-M technologies would be a plus. The successfu…"
5776518817,Software Engineer,Match Point Solutions,Bangalore,,India,2026-06-25 23:21:38+00:00,"About MatchPoint Solutions MatchPoint Solutions is a fast-growing global IT and Engineering services firm delivering innovative technology solutions to leading enterprises including Uber, Robinhood, Netflix, Airbnb, Google, and more. With a growing international presence across North America, Europe, Asia, and South America, we help organizations turn ideas into outcomes through cutting-edge technology, industry best practices, and deep technical expertise. We're expanding our team and looking …"
5776583344,Software Engineer,Recruitment Room,,,India,2026-06-26 00:35:21+00:00,"Software Engineer Contract Type: Contractor (1015 hours per week) Location: Remote Compensation: $20 $75 per hour Openings: 50 Job Summary We are seeking experienced Software Engineers to help train and evaluate next-generation AI systems through real-world engineering tasks. This role is ideal for developers who can reason through unfamiliar codebases, explain engineering decisions clearly, and solve practical backend, full-stack, systems, or infrastructure-related problems. A background in Cy…"
5776772795,Software Engineer,Bajaj Finance Limited,,,India,2026-06-26 02:36:11+00:00,Job Purpose Purpose of the job is to ensure Salesforce SME/B2C orgs deliveries from BLR ODC. Duties and Responsibilities Key Responsibilities: • Responsible for Change process management and status reporting • Understand the technology infrastructure and Application architecture end to end to improve technology platforms • Manage assigned projects within given time • Adhere to quality / info-security guidelines and processes including maintain adequate documentation • Coordinating and collabora…
5776786454,Software Engineer,CSC,Bangalore,Karnataka,India,2026-06-26 02:38:02+00:00,"Description Role : Software Engineer Location : Bengaluru Work Schedule : 12 pm - 9 pm Work Mode : Hybrid (3 day in office) Job Responsibilities: Collaborate proactively with a distributed team, including developers, quality assurance, project management, and product management teams to deliver quality software in a fast-paced environment Design, develop and deploy technical PEGA based software solutions Work in Agile / Scrum software delivery life cycle Provide input to technical design proces…"
5776799144,Software Engineer,eBay,Bangalore,Karnataka,India,2026-06-26 02:39:49+00:00,"At eBay, we're more than a global ecommerce leader — we’re changing the way the world shops and sells. Our platform empowers millions of buyers and sellers in more than 190 markets around the world. We’re committed to pushing boundaries and leaving our mark as we reinvent the future of ecommerce for enthusiasts. Our customers are our compass, authenticity thrives, bold ideas are welcome, and everyone can bring their unique selves to work — every day. We're in this together, sustaining the futur…"
5777263993,Software Engineer,NetApp,Bangalore,Karnataka,India,2026-06-26 10:38:52+00:00,"Job Summary Our mission at NetApp Instaclustr ( www.instaclustr.com ) is to make it easy for customers around the globe to run powerful open-source applications at scale - like Cassandra, Kafka, PostgreSQL, OpenSearch, Cadence, and ClickHouse, across both on-premises data-centres and in the cloud. The NetApp Instaclustr development team is responsible for building, maintaining and operating the platform that allows us to provision and reliably keep thousands of distributed application servers r…"
5777753871,Software Engineer,Weekday AI,,,India,2026-06-26 18:36:53+00:00,"This role is for one of Weekday’s clients Salary range: Rs 600000 - Rs 4200000 (ie INR 6 - 42 LPA) Min Experience: 3 years Location: banglaore JobType: full-time Requirements Have 3 years of experience building and shipping high-quality software in fast-moving teams. Min 3 years of experience with React, Typescript and NodeJS Write code with taste, empathy, and pride - you think about the person reading your code next. Have shipped real products at scale and know what it takes to keep them main…"
5778919609,Software Engineer,Persistent Systems,Nagpur,Maharashtra,India,2026-06-27 14:58:12+00:00,"About Persistent We are an AI-led, platform-driven Digital Engineering and Enterprise Modernization partner, combining deep technical expertise and industry experience to help our clients anticipate what’s next. Our offerings and proven solutions create a unique competitive advantage for our clients by giving them the power to see beyond and rise above. We work with many industry-leading organizations across the world, including 20 Fortune 50 companies and 4 of the 5 top banks in both the US an…"
5779379517,Software Engineer,Ford Motor,Chennai,Tamil Nadu,India,2026-06-28 02:28:27+00:00,"Description The candidate should have a strong background in 3DX Configuration, Data Model, Customization (Widget / webservices / Enovia), software development and Devops practices. As a Technical lead, you will be responsible for designing, developing, and implementing 3DX based / microservices-based applications . Responsibilities He / She would be responsible for designing, developing, and implementing 3DX solutions in BOM, Requirements mgmt., Verification & Validation, Change, Issue managem…"
5780528501,Software Engineer,Natwest Group,Bangalore,Karnataka,India,2026-06-29 02:35:52+00:00,"Join us as a Software Engineer This is an opportunity for a driven Software Engineer to take on an exciting new career challenge Day-to-day, you'll build a wide network of stakeholders of varying levels of seniority It’s a chance to hone your existing technical skills and advance your career We're offering this role at senior analyst level What you'll do In your new role, you’ll engineer and maintain innovative, customer centric, high performance, secure and robust solutions. You’ll be working …"
5780830354,Software Engineer,Microsoft Corporation,Bangalore,Karnataka,India,2026-06-29 10:31:27+00:00,"Overview Microsoft is a company where passionate innovators come to collaborate, envision what can be and take their careers further. This is a world of more possibilities, more innovation, more openness, and the sky is the limit thinking in a cloud-enabled world. Microsoft's Azure Data engineering team is leading the transformation of analytics in the world of data with products like databases, data integration, big data analytics, messaging & real-time analytics, and business intelligence. Th…"
5781141292,Software Engineer,Akamai Technologies,Bangalore,Karnataka,India,2026-06-29 18:13:08+00:00,"Job Description Do you relish the prospect of working with cutting edge technology? Do you love collaborating with teams to solve complex challenges? Join our world-class Cloud Manager Team Our Cloud Manager Team is a group of dedicated professionals shaping Akamai's aspirations to create an industry-leading user experience. We take ownership for the design and development for core interfaces, applications, APIs and services. We create an experience that allows customers and internal stakeholde…"
5781267914,Software Engineer,Trigent Software Private Limited,Hyderabad,,India,2026-06-29 23:20:10+00:00,"We are looking for a skilled Database Developer with 4 to 6 years of experience in Oracle PL/SQL engineering and database validation. In this role, you will design, develop, and optimize robust database architectures while taking hands-on responsibility for manual testing and verification of backend components. Primary skills - Oracle PL/SQL with design, development and Manual Testing. Core Java (added advantage). Key Responsibilities: Design, develop, and test moderately complex software syste…"
5782302099,Software Engineering - Custom Software Engineer,Trigent Software Private Limited,Gurgaon,,India,2026-06-30 23:27:13+00:00,"As a Custom Software Engineer, a typical day involves creating tailored software solutions by designing, coding, and improving various components within systems or applications. The role requires working with contemporary frameworks and following agile methodologies to ensure the delivery of scalable and efficient software that meets unique business requirements. Collaboration with team members and adapting to evolving project needs are integral parts of the daily workflow, fostering innovation…"
5782687184,Software Engineer,Trellix,Bangalore,Karnataka,India,2026-07-01 07:15:24+00:00,"Role Overview: Software Engineer having 2 to 5 years of experience in Mac/Linux Development environment (C, C++, OOPs Concepts, Swift, Data Structure and Algorithm, Multi-threading etc.) Experience in Mac/Linux internals and Security domain, in Crash dump analysis, shell scripting, Make file concept, JS, excellent debugging skills will be an added advantage. As a Software Engineer, you will be an integral part of the Trellix Endpoint Security for Mac team in India (Bangalore), responsible for d…"
5782848889,Software Engineer,02 May,Rajkot,Gujarat,India,2026-07-01 10:15:43+00:00,"We are looking for a passionate Software Engineer to design, develop, and install software solutions. Software Engineer responsibilities include gathering user requirements, defining system functionality and writing code in various languages, like Java, Ruby on Rails or .NET programming languages (e.g. C++ or JScript.NET.) Our ideal candidates are familiar with the software development life cycle (SDLC) from preliminary system analysis to tests and deployment. Ultimately, the role of the Softwa…"
5784086960,Software Engineer,Pratiti Technologies Pvt. Ltd.,Pune,,India,2026-07-02 00:14:16+00:00,"Bachelor’s or Master’s degree in Computer or Mechanical Engineering (BE/B.Tech/ME/MTech), Master of Computer Applications (MCA), or MSc in Mathematics is required. 3 to 6 years of software development experience in CAD/CAM/CAE/3D Graphics or PLM Client-Server applications. Strong expertise in C/C++ programming within CAD/CAM/CAE/Graphics/Visualization product development. Knowledge of COM, design patterns, OOAD, computational geometry algorithms, and familiarity with graphics libraries like Ope…"
5784312910,Software Engineer,Natwest Group,Bangalore,Karnataka,India,2026-07-02 02:43:32+00:00,"Join us as a Software Engineer This is an opportunity for a driven Software Engineer to take on an exciting new career challenge Day-to-day, you'll build a wide network of stakeholders of varying levels of seniority It’s a chance to hone your existing technical skills and advance your career We're offering this role at associate level What you'll do In your new role, you’ll engineer and maintain innovative, customer centric, high performance, secure and robust solutions. You’ll be working withi…"
5784339625,Software Engineer,Natwest Group,Bangalore,Karnataka,India,2026-07-02 02:48:21+00:00,"Join us as a Software Engineer This is an opportunity for a driven Software Engineer to take on an exciting new career challenge Day-to-day, you'll be engineering and maintaining innovative, customer centric, high performance, secure and robust solutions It’s a chance to hone your existing technical skills and advance your career while building a wide network of stakeholders We're offering this role at associate level What you'll do In your new role, you’ll be working within a feature team to e…"
5784353668,Software Engineer,Autodesk,,,India,2026-07-02 02:51:05+00:00,"Job Requisition ID  26WD99323 Position Overview We’re growing our Cloud Platform & Infrastructure Engineering team within Autodesk’s Digital Enterprise Services IT organization. This team leverages Software Engineering principles to build the foundations for the company’s business critical systems and processes, utilizing “cloud-first” platforms and services. Our engineering culture will empower you to make effective decisions, work collaboratively and take accountability for engineering projec…"
5785732148,Software Engineer,Experian,Hyderabad,Telangana,India,2026-07-03 00:06:50+00:00,"Job Description Design, develop, and maintain JavaScript-based mobile SDKs and integration layers for Android (Kotlin/Java) and iOS (Swift), ensuring performance, scalability, and reliability. Develop and support backend services and REST APIs using Java Spring Boot for scalable full‑stack solutions. Integrate AI/ML capabilities into applications (e.g., model inference, automation, intelligent decision systems). Collaborate with product, design, and data teams to build user‑centric solutions. E…"
5785770726,Senior Software Engineer,ABB,Bangalore,Karnataka,India,2026-07-03 00:54:11+00:00,"This job is with ABB, an inclusive employer and a member of myGwork – the largest global platform for the LGBTQ business community. Please do not contact the recruiter directly. At ABB, we help industries run leaner and cleaner—and every person here makes that happen. You’ll be empowered to lead, supported to grow, and proud of the impact we create together. Join us and help run what runs the world. This Position reports to: Principal Software Engineer ABB's Process Automation business area ena…"
5785771096,Manager of Software Engineering,Morningstar,Mumbai,Maharashtra,India,2026-07-03 00:54:13+00:00,"This job is with Morningstar, an inclusive employer and a member of myGwork – the largest global platform for the LGBTQ business community. Please do not contact the recruiter directly. Job Overview As an Engineering Manager, you will play a pivotal role in enabling a stream-aligned team focused on delivering a successful migration of datasets to a newly architected and designed pipeline. You will work closely with the Lead Software Development Engineer to ensure the team is empowered, autonomo…"
5785771111,Lead Software Engineer,Morningstar,Mumbai,Maharashtra,India,2026-07-03 00:54:13+00:00,"This job is with Morningstar, an inclusive employer and a member of myGwork – the largest global platform for the LGBTQ business community. Please do not contact the recruiter directly. Lead Software Engineer ( Full Stack, Java, AWS ) Location: Vashi, Navi Mumbai The Role: At Morningstar, helping investors is what brings us together and drives our work. We are looking for a Lead Software Engineer who combines deep technical expertise with strong ownership and leadership. This role is critical i…"
5785771069,Staff Software Engineer,Moody's,Bangalore,Karnataka,India,2026-07-03 00:54:13+00:00,"This job is with Moody's, an inclusive employer and a member of myGwork – the largest global platform for the LGBTQ business community. Please do not contact the recruiter directly. At Moody's, we unite the brightest minds to turn today’s risks into tomorrow’s opportunities. We do this by striving to create an inclusive environment where everyone feels welcome to be who they are—with the freedom to exchange ideas, think innovatively, and listen to each other and customers in meaningful ways. Mo…"
5785771281,Senior Software Engineer,Morningstar,Mumbai,Maharashtra,India,2026-07-03 00:54:14+00:00,"This job is with Morningstar, an inclusive employer and a member of myGwork – the largest global platform for the LGBTQ business community. Please do not contact the recruiter directly. Location: Mumbai Reports to: Tech Team Lead About the Role We are looking for a Software Developer/Data Scientist to join our Data Services team, specializing in delivering custom client-ready reports and managing data corrections. This role requires strong technical skills in Python, SQL, and Excel, combined wi…"
5785771302,Senior Software Engineer,Morningstar,Mumbai,Maharashtra,India,2026-07-03 00:54:15+00:00,"This job is with Morningstar, an inclusive employer and a member of myGwork – the largest global platform for the LGBTQ business community. Please do not contact the recruiter directly. Senior Software Engineer (Front End-Focused Full Stack, .NET & AWS) - Workplace Solutions Our Team: Technology drives our business. Our team is made up of talented software engineers, infrastructure engineers, leaders and UX professionals. We care about technology as a craft and a differentiator. We bring our gl…"
5785771851,Software Engineer,Cornerstone OnDemand,Hyderabad,Telangana,India,2026-07-03 00:54:20+00:00,"This job is with Cornerstone OnDemand, an inclusive employer and a member of myGwork – the largest global platform for the LGBTQ business community. Please do not contact the recruiter directly. We are building next-generation platforms that leverage AI and machine learning to transform how organizations understand, develop, and deploy talent. Our applications serve enterprise clients and individual users through sophisticated web interfaces that handle complex data visualization, real-time ana…"
5785771837,Software Engineer,eBay,Bangalore,Karnataka,India,2026-07-03 00:54:20+00:00,"This job is with eBay, an inclusive employer and a member of myGwork – the largest global platform for the LGBTQ business community. Please do not contact the recruiter directly. At eBay, we're more than a global ecommerce leader - we're changing the way the world shops and sells. Our platform empowers millions of buyers and sellers in more than 190 markets around the world. We're committed to pushing boundaries and leaving our mark as we reinvent the future of ecommerce for enthusiasts. Our cu…"
5785771816,"MTS2, Software Engineer",eBay,Bangalore,Karnataka,India,2026-07-03 00:54:20+00:00,"This job is with eBay, an inclusive employer and a member of myGwork – the largest global platform for the LGBTQ business community. Please do not contact the recruiter directly. At eBay, we're more than a global ecommerce leader - we're changing the way the world shops and sells. Our platform empowers millions of buyers and sellers in more than 190 markets around the world. We're committed to pushing boundaries and leaving our mark as we reinvent the future of ecommerce for enthusiasts. Our cu…"
5785771924,Software Engineer,Morningstar,Mumbai,Maharashtra,India,2026-07-03 00:54:21+00:00,"This job is with Morningstar, an inclusive employer and a member of myGwork – the largest global platform for the LGBTQ business community. Please do not contact the recruiter directly. As a member of the Product and Engineering team at PitchBook, you will be part of a team of big thinkers, innovators and problem solvers who strive to deepen the positive impact we have on our customers and our company every day. We value curiosity and the drive to find better ways of doing things. We thrive on …"
5785772072,Software Engineer,ABB,Bangalore,Karnataka,India,2026-07-03 00:54:22+00:00,"This job is with ABB, an inclusive employer and a member of myGwork – the largest global platform for the LGBTQ business community. Please do not contact the recruiter directly. At ABB, we help industries run leaner and cleaner—and every person here makes that happen. You’ll be empowered to lead, supported to grow, and proud of the impact we create together. Join us and help run what runs the world. This Position reports to: Principal Software Engineer What we believe in ABB's Process Automatio…"
5785772049,Software Engineering Lead,LexisNexis Legal & Professional®,Gurgaon,Haryana,India,2026-07-03 00:54:22+00:00,"This job is with LexisNexis Legal & Professional®, an inclusive employer and a member of myGwork – the largest global platform for the LGBTQ business community. Please do not contact the recruiter directly. Software Engineering Lead Are you interested in bringing your technical expertise to projects? Are you a detail-oriented paralegal with a 'can do' attitude? About our Team LexisNexis Legal & Professional, which serves customers in more than 150 countries with 11,300 employees worldwide, is p…"
5785772373,Staff Software Engineer,Moody's,Noida,,India,2026-07-03 00:54:24+00:00,"This job is with Moody's, an inclusive employer and a member of myGwork – the largest global platform for the LGBTQ business community. Please do not contact the recruiter directly. At Moody's, we unite the brightest minds to turn today’s risks into tomorrow’s opportunities. We do this by striving to create an inclusive environment where everyone feels welcome to be who they are—with the freedom to exchange ideas, think innovatively, and listen to each other and customers in meaningful ways. Mo…"
5785772514,Software Engineering Lead,RX Global,Chennai,Tamil Nadu,India,2026-07-03 00:54:27+00:00,"This job is with RX Global, an inclusive employer and a member of myGwork – the largest global platform for the LGBTQ business community. Please do not contact the recruiter directly. About Team: RX Global aims to create unforgettable experiences for attendees and exhibitors through organizing events. Innovation, creativity, and collaboration drive the company to offer exceptional services to clients. About the role: Lead teams. Build great software. Deliver real impact. We're looking for a Sof…"
