source_job_id,title,company,city,state,country,created_at,description
5785772511,Senior Software Engineer,Morningstar,Mumbai,Maharashtra,India,2026-07-03 00:54:27+00:00,"This job is with Morningstar, an inclusive employer and a member of myGwork – the largest global platform for the LGBTQ business community. Please do not contact the recruiter directly. Position Title: Senior Software Engineer The Group: Morningstar's Research group provides independent analysis on individual securities, funds, markets, and portfolios. The Research group also provides data on hundreds of thousands of investment offerings, including stocks, mutual funds, and similar vehicles, al…"
5785772605,Senior Software Engineer,eBay,Bangalore,Karnataka,India,2026-07-03 00:54:27+00:00,"This job is with eBay, an inclusive employer and a member of myGwork – the largest global platform for the LGBTQ business community. Please do not contact the recruiter directly. At eBay, we're more than a global ecommerce leader - we're changing the way the world shops and sells. Our platform empowers millions of buyers and sellers in more than 190 markets around the world. We're committed to pushing boundaries and leaving our mark as we reinvent the future of ecommerce for enthusiasts. Our cu…"
5785772915,Senior Software Engineer,Wise,Hyderabad,Telangana,India,2026-07-03 00:54:30+00:00,"This job is with Wise, an inclusive employer and a member of myGwork – the largest global platform for the LGBTQ business community. Please do not contact the recruiter directly. Wise is a global technology company, building the best way to move and manage the world’s money. Min fees. Max ease. Full speed. Whether people and businesses are sending money to another country, spending abroad, or making and receiving international payments, Wise is on a mission to make their lives easier and save t…"
5785773087,Software Engineer,Cornerstone OnDemand,Hyderabad,Telangana,India,2026-07-03 00:54:32+00:00,"This job is with Cornerstone OnDemand, an inclusive employer and a member of myGwork – the largest global platform for the LGBTQ business community. Please do not contact the recruiter directly. Cornerstone OnDemand is looking for a AI Engineer whowill lead the design and development of AI-powered solutions using MicrosoftAzure AI services, Copilot, and Generative AI technologies. You will beresponsible for building intelligent automation solutions, implementing AImodels, and creating custom Ge…"
5786031104,Software Engineer,ABB,Bangalore,Karnataka,India,2026-07-03 02:58:48+00:00,"At ABB, we help industries run leaner and cleaner—and every person here makes that happen. You’ll be empowered to lead, supported to grow, and proud of the impact we create together. Join us and help run what runs the world. This Position reports to: Principal Software Engineer What we believe in ABB's Process Automation business area enables customers to operate some of the world's largest and most complex industrial infrastructures, helping them outrun – leaner and cleaner. We offer a broad r…"
5786033328,Software Engineer,London Stock Exchange Group,,,India,2026-07-03 03:01:19+00:00,"LSEG Data & Analytics is one of the world’s largest providers of financial markets data and infrastructure. With over 40,000 customers and 400,000 end users across approximately 190 markets, we are an essential partner to the global financial community and redefining the future of data in financial services. We enable customers to draw crucial insights through data, feeds, analytics, AI and workflow solutions. Our engineers design, develop and deliver the products and services that reimagine ho…"
5786195088,Software Engineer,Scout Incorporation,,,India,2026-07-03 06:24:17+00:00,"We're looking for Software Engineers! Qualifications : Proficiency in software development or a related field Familiarity working on project(s) involving the implementation of solutions applying development life cycles (SDLC) through iterative agile development Familiarity working with any of the following: frontend technologies (user interface/user experience), middleware (microservices and application programming interfaces), database technologies, or DevOps Bachelors Degree in computer scien…"
5787032333,Software Engineer,NielsenIQ,Pune,Maharashtra,India,2026-07-04 00:44:33+00:00,"Job Description Responsibilities: Designs and develops scalable, reusable, and high-performance UI components and web applications. Implements modern frontend architectures using best practices (component-driven design, state management, modular structure). Builds responsive and accessible web applications ensuring cross-browser compatibility and optimal performance. Applies clean coding practices, SOLID principles, and design patterns to frontend development. Develops dynamic user interfaces w…"
5787126832,Software Engineer,Ignatiuz,Hyderabad,,India,2026-07-04 02:22:12+00:00,"Maintain and enhance the Conversion IDE, a .NET desktop application written in C# that the onboarding team uses to migrate new customer data into Evolution. Incorporate ongoing product updates into the C# NuGet package used by conversion specialists in the field. Design and build backend services and APIs (.NET 8) as the team transitions from the existing desktop tooling toward a new service-oriented conversion platform. Work with large, complex datasets and database operations, supporting data…"
5787232626,Software Engineer,Barclays,,,India,2026-07-04 02:36:55+00:00,"Job Description Purpose of the role To design, develop and improve software, utilising various engineering methodologies, that provides business, platform, and technology capabilities for our customers and colleagues. Accountabilities Development and delivery of high-quality software solutions by using industry aligned programming languages, frameworks, and tools. Ensuring that code is scalable, maintainable, and optimized for performance. Cross-functional collaboration with product managers, d…"
5787270665,Software Engineer,Natwest Group,,,India,2026-07-04 02:45:22+00:00,"Join us as a Software Engineer This is an opportunity for a driven Software Engineer to take on an exciting new career challenge Day-to-day, you'll be engineering and maintaining innovative, customer centric, high performance, secure and robust solutions It’s a chance to hone your existing technical skills and advance your career while building a wide network of stakeholders We're offering this role at associate level What you'll do In your new role, you’ll be working within a feature team to e…"
5787272729,Software Engineer,Alteryx,Bangalore,Karnataka,India,2026-07-04 02:47:36+00:00,"Meet the Moment with Alteryx We're living through a once-in-a-generation shift in how work gets done. Data, automation, and AI are quickly becoming the center of every business decision - and Alteryx is leading the transformation. You'll be working on the challenges that sit at the heart of modern business. No matter your role, the work you do will help organizations move faster, see more clearly, and tackle questions that used to feel impossible. If you're ready to meet the moment with innovat…"
5787828521,Software Engineer,Visa,,,India,2026-07-04 15:03:38+00:00,"About Us Visa is a world leader in payments technology, facilitating transactions between consumers, merchants, financial institutions and government entities across more than 200 countries and territories, dedicated to uplifting everyone, everywhere by being the best way to pay and be paid. At Visa, you'll have the opportunity to create impact at scale — tackling meaningful challenges, growing your skills and seeing your contributions impact lives around the world. Join Visa and do work that m…"
5788362597,Software Engineer,Sagility,,,India,2026-07-05 03:32:28+00:00,"Sagility combines industry-leading technology and transformation-driven BPM services with decades of healthcare domain expertise to help clients draw closer to their members. The company optimizes the entire member/patient experience through service offerings for clinical, case management, member engagement, provider solutions, payment integrity, claims cost containment, and analytics. Sagility has more than 25,000 employees across 5 countries. Hands-on experience with specific analytics tools …"
5788399741,Software Engineer,Natwest Group,Bangalore,Karnataka,India,2026-07-05 03:34:44+00:00,"Join us as a Software Engineer This is an opportunity for a technically minded individual to join us as a Software Engineer You’ll be designing, producing, testing and implementing working software, working across the lifecycle of the system Hone your existing software engineering skills and advance your career in this critical role What you'll do Working in a permanent feature team, you’ll be developing knowledge of aspects of the associated platform across the disciplines of business, applica…"
5788462800,Software Engineer,Cisco Systems,Bangalore,Karnataka,India,2026-07-05 03:37:30+00:00,"Meet the Team Our Incident Command Software Engineering team is a diverse and hardworking group that shares a passion for sophisticated software and computer security. We stay a step ahead of the evolving threat landscape in an AI-enabled, fast-paced Agile environment, combining Kanban, continuous integration and deployment, and close collaboration with vendors, partners, and industry leaders. Your Impact As a Software Engineer, you will help build and extend next-generation incident detection …"
5790410126,Senior Software Engineer,Moody's,Bangalore,Karnataka,India,2026-07-07 05:28:17+00:00,"This job is with Moody's, an inclusive employer and a member of myGwork – the largest global platform for the LGBTQ business community. Please do not contact the recruiter directly. At Moody's, we unite the brightest minds to turn today’s risks into tomorrow’s opportunities. We do this by striving to create an inclusive environment where everyone feels welcome to be who they are—with the freedom to exchange ideas, think innovatively, and listen to each other and customers in meaningful ways. Mo…"
5790410205,Software Engineering - Development,Kyndryl,,,India,2026-07-07 05:28:19+00:00,"This job is with Kyndryl, an inclusive employer and a member of myGwork – the largest global platform for the LGBTQ business community. Please do not contact the recruiter directly. Who We Are At Kyndryl, we run and reimagine the mission-critical technology systems that drive advantage for the world's leading businesses. We are at the heart of progress; with proven expertise and a continuous flow of AI-powered insight, enabling smarter decisions, faster innovation, and a lasting competitive edg…"
5790410289,Software Engineering QA,Kyndryl,,,India,2026-07-07 05:28:21+00:00,"This job is with Kyndryl, an inclusive employer and a member of myGwork – the largest global platform for the LGBTQ business community. Please do not contact the recruiter directly. Who We Are At Kyndryl, we run and reimagine the mission-critical technology systems that drive advantage for the world's leading businesses. We are at the heart of progress; with proven expertise and a continuous flow of AI-powered insight, enabling smarter decisions, faster innovation, and a lasting competitive edg…"
5790410300,Software Engineer II,Elsevier,Chennai,Tamil Nadu,India,2026-07-07 05:28:22+00:00,"This job is with Elsevier, an inclusive employer and a member of myGwork – the largest global platform for the LGBTQ business community. Please do not contact the recruiter directly. Would you like to be part of a team that delivers high-quality software to our customers? Are you a visible champion with a 'can do' attitude and enthusiasm that inspires others? About our Team : Our global team support products education electronic health records that introduce students to digital charting and pre…"
5790410340,Software Engineering- Development,Kyndryl,Noida,,India,2026-07-07 05:28:33+00:00,"This job is with Kyndryl, an inclusive employer and a member of myGwork – the largest global platform for the LGBTQ business community. Please do not contact the recruiter directly. Who We Are At Kyndryl, we run and reimagine the mission-critical technology systems that drive advantage for the world's leading businesses. We are at the heart of progress; with proven expertise and a continuous flow of AI-powered insight, enabling smarter decisions, faster innovation, and a lasting competitive edg…"
5790410669,Senior Software Engineer,Kyndryl,Bangalore,Karnataka,India,2026-07-07 05:28:45+00:00,"This job is with Kyndryl, an inclusive employer and a member of myGwork – the largest global platform for the LGBTQ business community. Please do not contact the recruiter directly. Who We Are At Kyndryl, we run and reimagine the mission-critical technology systems that drive advantage for the world's leading businesses. We are at the heart of progress; with proven expertise and a continuous flow of AI-powered insight, enabling smarter decisions, faster innovation, and a lasting competitive edg…"
5790410640,Senior Software Engineer,Kyndryl,Pune,Maharashtra,India,2026-07-07 05:28:45+00:00,"This job is with Kyndryl, an inclusive employer and a member of myGwork – the largest global platform for the LGBTQ business community. Please do not contact the recruiter directly. Who We Are At Kyndryl, we run and reimagine the mission-critical technology systems that drive advantage for the world's leading businesses. We are at the heart of progress; with proven expertise and a continuous flow of AI-powered insight, enabling smarter decisions, faster innovation, and a lasting competitive edg…"
5790410697,Senior Software Engineer,ABB,Bangalore,Karnataka,India,2026-07-07 05:28:51+00:00,"This job is with ABB, an inclusive employer and a member of myGwork – the largest global platform for the LGBTQ business community. Please do not contact the recruiter directly. At ABB, we help industries run leaner and cleaner—and every person here makes that happen. You’ll be empowered to lead, supported to grow, and proud of the impact we create together. Join us and help run what runs the world. This Position reports to: Digital Solution Engineering Manager What we believe in ABB's Process …"
5790907186,Software Engineer III,Elsevier,Bangalore,Karnataka,India,2026-07-07 15:28:27+00:00,"This job is with Elsevier, an inclusive employer and a member of myGwork – the largest global platform for the LGBTQ business community. Please do not contact the recruiter directly. Would you like to be part of a team that delivers high-quality software to our customers? Are you a highly visible champion with a 'can do' attitude and enthusiasm that inspires others? About the team: A global leader in information and analytics, we help researchers and healthcare professionals advance science and…"
5790907274,Software Engineer (ACP),Avaloq,Pune,Maharashtra,India,2026-07-07 15:28:34+00:00,"This job is with Avaloq, an inclusive employer and a member of myGwork – the largest global platform for the LGBTQ business community. Please do not contact the recruiter directly. Company Description Founded and headquartered in Switzerland, Avaloq is continuously expanding its global footprint with around 2,500 colleagues in 10 countries, and more than 160 clients in 35 countries. We are an industry-leading provider of wealth management technology and services for financial institutions aroun…"
5792095668,Senior Software Engineer,Moody's,Noida,,India,2026-07-08 11:28:54+00:00,"This job is with Moody's, an inclusive employer and a member of myGwork – the largest global platform for the LGBTQ business community. Please do not contact the recruiter directly. At Moody's, we unite the brightest minds to turn today’s risks into tomorrow’s opportunities. We do this by striving to create an inclusive environment where everyone feels welcome to be who they are—with the freedom to exchange ideas, think innovatively, and listen to each other and customers in meaningful ways. Mo…"
5794153227,Software Engineer,Morningstar,Mumbai,Maharashtra,India,2026-07-09 17:58:24+00:00,"This job is with Morningstar, an inclusive employer and a member of myGwork – the largest global platform for the LGBTQ business community. Please do not contact the recruiter directly. Morningstar DBRS is a leading provider of independent credit rating services and opinions for corporate and sovereign entities, financial institutions, and project and structured finance instruments globally. Rating more than 4,500 issuers and 68,000 securities, we are one of the top four credit rating agencies …"
5794153470,Senior Software Engineer,Morningstar,Mumbai,Maharashtra,India,2026-07-09 17:58:35+00:00,"This job is with Morningstar, an inclusive employer and a member of myGwork – the largest global platform for the LGBTQ business community. Please do not contact the recruiter directly. About the Role We are looking for a Senior Software Engineer to drive the design, development, and scaling of our centralized, API-driven data validation platform. This is a hands-on individual contributor role focused on building high-performance, scalable, and intelligent validation systems that process large …"
5794768004,Software Engineer,Kyndryl,Bangalore,Karnataka,India,2026-07-10 03:46:23+00:00,"This job is with Kyndryl, an inclusive employer and a member of myGwork – the largest global platform for the LGBTQ business community. Please do not contact the recruiter directly. Who We Are At Kyndryl, we run and reimagine the mission-critical technology systems that drive advantage for the world's leading businesses. We are at the heart of progress; with proven expertise and a continuous flow of AI-powered insight, enabling smarter decisions, faster innovation, and a lasting competitive edg…"
5795883329,Software Engineer 3,eBay,Bangalore,Karnataka,India,2026-07-10 23:42:39+00:00,"This job is with eBay, an inclusive employer and a member of myGwork – the largest global platform for the LGBTQ business community. Please do not contact the recruiter directly. At eBay, we're more than a global ecommerce leader - we're changing the way the world shops and sells. Our platform empowers millions of buyers and sellers in more than 190 markets around the world. We're committed to pushing boundaries and leaving our mark as we reinvent the future of ecommerce for enthusiasts. Our cu…"
5795883420,Software Engineer 2,eBay,Bangalore,Karnataka,India,2026-07-10 23:43:06+00:00,"This job is with eBay, an inclusive employer and a member of myGwork – the largest global platform for the LGBTQ business community. Please do not contact the recruiter directly. At eBay, we're more than a global ecommerce leader - we're changing the way the world shops and sells. Our platform empowers millions of buyers and sellers in more than 190 markets around the world. We're committed to pushing boundaries and leaving our mark as we reinvent the future of ecommerce for enthusiasts. Our cu…"
